Judul,Jenis
Chelsea Maju ke Final Piala Dunia Antar Klub,Olahraga
Inilah Alasan QUIC Masih Mengkhawatirkan Operator Seluler (Forum Pembaca),Teknologi
"70 Persen Air Minum Rumah Tangga di RI Tercemar Tinja, Ini Langkah UNICEF",Kesehatan
"OJK: lembaga keuangan, jangan dibantuin ya perdagangan aset crypto…",Teknologi
Apa itu JHT dan JKN? Kenapa Diperdebatkan?,Finansial
Obat-obat pas isoman buat apa aja?,Kesehatan
Gass! Blind Date on Tinder,Teknologi
Game Battle Royale Baru Ini Masih Gratis,Gaming
Jaga Mental Health Kita Selama Pandemi!,Kesehatan
Intel Buat Chip Untuk Kripto dan NFT,Teknologi
"Ancaman Perang, Ekonomi Indonesia Masih Aman ?",Finansial
Mengenal SpaceX dan Spacewalk Komersil Pertamanya!,Teknologi
Skenario Finansial Jika Perang Dunia Ketiga Benar-Benar Terjadi,Finansial
Kriteria Kontak Erat COVID-19 yang Wajib Dipahami untuk Cegah Omicron,Kesehatan
Disney menunjuk seorang eksekutif secara khusus memimpin strategi untuk metaverse.,Teknologi
"Mbappe Berubah Pikiran, Kini Enggan ke Real Madrid",Olahraga
Indomaret Timbun Minyak Goreng?,Finansial
Bank Dunia Menghabiskan Dana Rp 2.245 Triliun Untuk Tangani Covid-19,Finansial
"“Omicron Cuman Pilek Biasa.” Eitss.. Hati-hati, Varian Ini Bisa Bikin Mr. P Susah Ereksi",Kesehatan
Udah Siap Belum Nih Makan Tanpa Tempe dan Tahu?,Finansial
"Modal Asing Masuk Rp10,81 T Pekan lalu. Pertanda asing masih percaya?",Finansial
Beberapa Rilisan Game Gagal Oleh Publisher Besar,Gaming
Yuk Donor Mata Kita!,Kesehatan
Hii… Data Kita Bisa Hilang Karena Streaming di Web Ilegal?,Teknologi
Saham Yang Jadi Mahar Nikah,Finansial
Kebiasaan Minum Kopi Bisa Kamu Ganti dengan 5 Makanan Ini,Kesehatan
Siap-siap! Syarat Urus SIM Bakal Membutuhkan BPJS Kesehatan,Finansial
"Investor Asing Catat Net Buy Sebesar 1.08 Miliar, IHSG Mengalami Tren Positif",Finansial
Apa Korelasi Cuaca Buruk dengan Koneksi Internet?,Teknologi
Meta dan Google blokir Media – Media Rusia,Teknologi
Game Ringan Berkualitas No Lag No Drama,Gaming
Indonesia sangat terpaku pada ponsel kata Data.ai,Teknologi
Spartak Moscow Didepak dari UEFA League,Olahraga
"Bye bye IGTV, you will be missed!",Teknologi
"Harga Gas Naik, Imbas Perang Rusia-Ukraina",Finansial
Gigi jadi lebih putih dengan terapkan 7 langkah ini,Kesehatan
"Review Singkat Gran Turismo 7, Worth Kah?",Gaming
Playerbase Elden Ring Setara Dota 2 dan Counter Strike,Gaming
Apple memperbarui iOS 15.4 dengan kemampuan membuka Face ID tanpa perlu lepas masker,Teknologi
"Koin Crypto Baru Muncul Terus, Buy or Bye nih?",Teknologi
"Minggu Ceria, Diskon Game-Game Bahagia",Gaming
Penggunaan Crowdsourcing untuk Evakuasi Warga Ukraina,Teknologi
Cepat Ambil Vaksin Boostermu!,Kesehatan
BREAKING NEWS! Gregoria Mariska Resmi Absen dari Swiss Open 2022,Olahraga
Hah… Ada Baterai Seukuran Garam?!,Teknologi
"Fahrenheit, Skema Ponzi, dan Ekonomi Perilaku",Finansial
Benarkah Puasa Menurunkan Kadar Kolesterol,Kesehatan
Xiaomi Mi 11 Meledak saat kondisi masih baru.,Teknologi
Hati-Hati! Pengguna Mobile Banking Harus Perhatikan Ini Bila SIM Card Mati,Finansial
"Jangan Anggap Sepele, Polusi Udara Bisa Menyebabkan Autisme hingga Ginjal",Kesehatan
UNUD Menjadi yang Pertama di Luar Jawa Ekspansi Program Campus Financial Ecosystem milik BNI,Finansial
Beli Minyak pake Bitcoin?,Finansial
Apakah BTC mulai menanjak kembali??,Teknologi
"Riders Republic Kemahalan, Mending Game Ini Aja",Gaming
Vaksinasi COVID Tidak Batalkan Puasa!,Kesehatan
"Produksi Iphone dan Airpods akan dipotong oleh Apple, Gimana nih ?",Teknologi
Marc Marquez Dipastikan Absen MotoGP Argentina,Olahraga
Cara Cek Lokasi Kamera E-Tilang di Aplikasi Waze,Teknologi
Waspadai Kenaikan Harga Pangan dan Inflasi,Finansial
Apa itu penyakit alopecia areata yang diderita istri Will Smith?,Kesehatan
"Ada Karakter Baru di Genshin Impact Versi 2.6, Nih !",Gaming
Telkom Membangun Data Center dan Cloud. Produktivitas akan Meningkat sebesar US$ 120 M,Teknologi
Perebutan 5 Sisa Tiket Piala Dunia,Olahraga
"PPN Naik Jadi 11 Persen, Harga Mie Instan Dan Minyak Goreng Juga Ikut Naik",Finansial
ARA ARA beruntun saham WOMF…,Finansial
"Banjir Dividen, Bikin Cuan di Bulan April",Finansial
Realme C35 Dijual dengan Harga 2 Juta di Indonesia,Teknologi
Perkiraan Harga Jalan Tol pada Google Maps akan hadir di Indonesia,Teknologi
IHSG Tembus Rekor Lagi!,Finansial
"Hati-hati, HP ini bisa memancarkan radiasi yang sangat tinggi",Teknologi
LINE Meluncurkan Pasar NFT di Jepang,Teknologi
Investor Pasar Modal Indonesia capai 8.3 Juta Orang!,Finansial
Xiaomi 10C akan Rilis di Indonesia. Yuk Simak Reviewnya !,Teknologi
Metaverse Sebagai Tempat Marketing yang Super Ampuh,Teknologi
"Elon Musk Beli Twitter, Pengguna Mulai Hilang",Teknologi
Permintaan domain ENS 4 digit melonjak minggu ini dan terus melonjak.,Teknologi
Kirim Uang Kripto dengan Telegram? Bagaimana ya ?,Teknologi
Grup Google Cloud membentuk tim Web3 untuk memanfaatkan popularitas kripto yang sedang booming,Teknologi
"Wabah Hepatitis Misterius, Banyak Menyerang Anak-Anak!",Kesehatan
Lakukan 3 Cek Kesehatan Ini Setelah Lebaran!,Kesehatan
Dunia Tanpa Password Lebih Terjamin Daripada dengan Password ?,Teknologi
Stablecoin Algoritmik: Apa Itu dan Bagaimana Mereka Bisa Sangat Salah,Teknologi
IHSG Ditutup Melemah Pada Minggu Pertama Setelah Libur Lebaran,Finansial
Imunisasi Anak akan Terdata Secara Digital di Aplikasi PeduliLingdungi,Kesehatan
"Kabar Gembira, Kemenkes Umumkan Senam Indonesia Bakal Dilakukan di Setiap Acara Resmi ASEAN",Kesehatan
Perusahaan Keuangan Morgan Stanley Capital International kembali melakukan rebalancing komposisi indeksnya,Finansial
SpaceX Ingin Bangun Bandara di IKN. Gimana ya ?,Teknologi
"Boleh Lepas Maker di Tempat Terbuka, Transmisi dari Pandemi ke Endemi",Kesehatan
"GOTO Naik 56%, IHSG Menguat",Finansial
Leica Resmi Bekerja Sama ke Xiaomi Setelah memutuskan hubungan dengan Huawei,Teknologi
"Munculnya Kasus Cacar Monyet, Indonesia Harus Tetap Waspada Walaupun Belum Ada Laporan Kasus",Kesehatan
6G akan hadir pada tahun 2030. Smartphone akan menghilang ?,Teknologi
IHSG menuju ke level 7.200!,Finansial
Stock split 3-untuk-1 Tesla: Tanggal dan Informasi untuk Investor.,Finansial
Bom difficulty Ethereum tertunda tetapi adopsi jaringan masih berkembang,Teknologi
"Mengapa Internet Mengobrol Tentang DALL-E Mini, Alat AI Gratis yang Mengubah Teks Apapun Menjadi Seni.",Teknologi
"Privasi, Skalabilitas, dan Interoperabilitas adalah masa depan Blockchain untuk DZK",Teknologi
IHSG Gagal Tembus Ke Level 7.200 Pekan Ini,Finansial
Pembajakan DNS Mengkompromikan Layanan Ankr untuk Polygon dan Fantom,Teknologi
Insinyur Google mengatakan sistem AI Lamda mungkin memiliki perasaannya sendiri,Teknologi
Sejumlah PSE besar belum terdaftar di PSE Kominfo.,Teknologi
"Pekan Ini, IHSG Ditutup Menurun Hampir 2 Persen",Finansial
"The Fed Resmi Naikkan Suku Bunga, Bagaimana Respon Bank Sentral Global?",Finansial
"IHSG Ditutup Menguat Pekan Ini Sebesar 0,64%",Finansial
China tampaknya telah menemukan cara membuat chip 7nm meskipun ada sanksi AS,Teknologi
Bank Indonesia Siap Keluarkan Rupiah Digital Sebagai Tender Resmi Pembayaran Digital,Teknologi
Ambulans Indonesia Jadi Contoh Bagi Negara Lain,Kesehatan
Paulo Banchero Menjadi 1st Pick Pada NBA Draft 2022,Olahraga
Kyrie Irving menuju LA Lakers?,Olahraga
Bagaimana Blockchain Membantu Memecahkan Kerawanan Pangan Di Afrika,Teknologi
"Tingkat Pengangguran AS Stabil, Rupiah Menguat Rp14.979 per Dolar AS",Finansial
"IHSG melemah 0,80 persen pada pekan lalu",Finansial
Game Terakhir lawan Juara Bertahan,Olahraga
Facebook Akan Rombak Tampilan Halaman Depan Mirip TikTok,Teknologi
"Implementasi Transformasi Layanan Primer, Kemenkes Gelar Pemberian Tablet Tambah Darah di Kabupaten Bogor",Kesehatan
Dua Langkah Terakhir Bagi Australia Untuk Pertahankan Gelar,Olahraga
"Hari Hepatitis Sedunia, “Bringing Hepatitis Care Closer to You”",Kesehatan
Babak Playoff IBL 2022 Akhirnya Mulai!,Olahraga
"Menjelang Mulainya NBA Musim 2022/23, Masih Banyak Pemain Yang Masih Free Agent",Olahraga
Ini Strategi Kemenkes Kembali Bangkitkan Layanan Kesehatan Pasca Pandemi,Kesehatan
"Suku Bunga The Fed Berpotensi Meningkat, Indeks Dolar AS Menyentuh Level Tertinggi!",Finansial
Ajang Balas Dendam Pelita Jaya Ataukah Satria Muda Berhasil Mempertahankan Gelar?,Olahraga
"Total Lebih Dari 1,5M Pounds Pada Bursa Transfer Musim Panas EPL!",Olahraga
Lagi-Lagi Satria Muda Keluar Sebagai Juara!,Olahraga
Bangkit berhasil meluluskan 2.517 mahasiswa dari 226 kampus se-Indonesia.,Teknologi
Peretas menggunakan 4 teknik ini untuk membobol akun anda,Teknologi
"Kalah Lagi, Ganti Pelatih Lagi.",Olahraga
Konsumsi Energi Ethereum Berkurang 99.99% setelah Merge Ethereum 2.0,Teknologi
Pembuat chip Qualcomm mengatakan bisnis otomotif masa depan berkembang menjadi $30 miliar,Teknologi
"Masa depan dapur awan: Efisiensi, pertumbuhan, ekspansi, dan lainnya",Teknologi
Seth Rollins Kalahkan Bobby Lashley dan Jadi United States Champion,Olahraga
3 Pertarungan yang Diantisipasi Saat WWE Crown Jewel 5 November 2022,Olahraga
Konsumsi Energi Ethereum Berkurang 99.99% setelah Merge Ethereum 2.0,Teknologi
Pembuat chip Qualcomm mengatakan bisnis otomotif masa depan berkembang menjadi $30 miliar,Teknologi
Kemenkes Minta Vaksin Booster COVID-19 Terus Digencarkan,Kesehatan
Seth Rollins Kalahkan Bobby Lashley dan Jadi United States Champion,Olahraga
Inklusifitas dalam Penurunan Stunting,Kesehatan
3 Pertarungan yang Diantisipasi Saat WWE Crown Jewel 5 November 2022,Olahraga
Ezra Miller akan Dipecat dari Peran The Flash,Hiburan
Elon Musk Akan PHK 75% Pegawai Twitter,Teknologi
"Tersandung Skandal Keuangan, Manchester City Terancam Degradasi",Olahraga