Judul,Jenis
Terapi Metadon Untuk Pecandu Heroin,Kesehatan
Tesla Menuntut Seorang Influencer Vlogger Asal Tiongkok Karena Alasan Ini,Teknologi
Lebih Melek pasar di Imlek 2022!,Finansial
Indonesia Resmi Masuk Gelombang Tiga COVID-19,Kesehatan
"Bocoran Render Desain Xiaomi 12 Mini, Flagship Compact dari Xiaomi dengan Layar hanya 6 inchi!",Teknologi
Mengenal lebih dalam Hari Kanker Sedunia,Kesehatan
"Ilmuwan Temukan Varian HIV Baru, Lebih Cepat Sebabkan AIDS",Kesehatan
Bocoran Tanggal Rilis iPhone SE Generasi Ketiga Mulai Terkuak!,Teknologi
"Vaping lebih aman dari rokok, betulkah?",Kesehatan
"Hari Kanker Sedunia, Kanker Serviks Masih Merajalela?",Kesehatan
Meta Terancam Cabut Instagram dan Facebook dari Uni Eropa Jika Tidak Lagi Mampu Melakukan Targeted Ads pada Penggunanya,Teknologi
"Berkat teknologi implan, pria lumpuh bisa berjalan kembali ",Kesehatan
Xiaomi Mendeklarasikan Perang Pada Apple di Pasar Smartphone,Finansial
Obat-obat pas isoman buat apa aja ?,Kesehatan
Selamat hari Senin! Siap kembali berinvestasi?,Finansial
Pengobatan anti-Omicron,Kesehatan
Mediatek Sedang Mengembangkan Chipset Seri Helio G dengan Fabrikasi 6 nm,Teknologi
Kini Mengirim Gambar Dengan Kualitas Original di Whatsapp Lebih Mudah,Teknologi
"Modal Asing Masuk Rp10,81 T Pekan lalu. Pertanda asing masih percaya ?",Finansial
"Tes Antigen Mandiri, perlu ga sih?",Kesehatan
PukulEnam.ai Resmi Diluncurkan!,Teknologi
Mengenal Teman-teman Kecil Kita di Usus,Kesehatan
"Spesifikasi ZTE Axon 40 bocor ke publik, Nubia Z40 Pro resmi dilengkapi pengisian daya nirkabel!",Teknologi
"Pilih mana, mandi air dingin atau panas?",Kesehatan
Uji Pra-Musim Formula 1 hari kedua: Ferrari master Blan!?,Olahraga
Ukraina meminta bantuan hacker membela melawan Rusia,Teknologi
"Aduh, kok aku sering cemas ya? Kayaknya aku anxiety deh",Kesehatan
Ruam-ruam abis kena COVID-19?,Kesehatan
"Peluang finansial nasional minggu ini, tidak hanya terpengaruh Rusia-Ukraina lho!",Finansial
Fix Banget! TelkomGroup bergabung pada mega proyek kabel laut Eropa-Asia Tenggara,Teknologi
"Negara-negara Barat seperti ""Mencoba Menghancurkan"" Ekonomi Rusia",Finansial
Balapan dengan Kece di Gran Turismo 7 x Anti Social Social Club!,Gaming
Rusia: Jangan beli Mac dulu ya.,Teknologi
"Tidak hanya vaksin, vitamin juga bisa disuntik lho",Kesehatan
"Penelitian tentang hubungan antara manusia dan hewan peliharaannya semakin banyak selama pandemi, ini hasilnya!",Kesehatan
"SAMSUNG MENGHENTIKAN PENGIRIMAN CHIP, PONSEL, DAN ELEKTRONIK SECARA KESELURUHAN KE RUSIA!",Teknologi
Apa yang terjadi ketika kita tenggelam?,Kesehatan
Syarat PCR dan Antigen untuk Perjalanan Resmi Dihapus,Kesehatan
Ngopi niat ngeeng malah ngos ngosan,Kesehatan
M1 Ultra resmi dirilis: Nyaris merobek AMD Threadripper 3990X!,Teknologi
Telegram Update Besar-Besaran!,Teknologi
Softbank: Sayounara Nusantara-Kun!,Finansial
Mau beli Macbook? Kalau masih bisa sabar? Tunggu ya!,Teknologi
Xiaomi Redmi K50 menjadi yang pertama menawarkan audio Bluetooth 5.3 dan LC3,Teknologi
Berburu pil iodin penangkal radiasi,Kesehatan
CEO Moderna Stephane Bancel telah menjual lebih dari 400 juta dollar AS saham perusahaan selama pandemi,Finansial
Apa manfaat Stress?,Kesehatan
Meta menghadirkan parental control di VR mekera!,Teknologi
Da-da Stradia! Dari platform cloud gaming jadi produk google cloud,Gaming
Masih sharing Netflix murah dari pihak ketiga yang bagi-bagi password? Hati-hati!,Teknologi
"ISS: Mau yang di bawah ribut, yang di atas tetap jalan!",Teknologi
Pemerintah Australia menggugat Facebook atas iklan penipuan yang membuat seolah dari selebritis.,Teknologi
"Sering mencari informasi media, hati-hati Cyberchondria",Kesehatan
"Uni Eropa Meminta Whatsapp dan iMessage ""bekerjasama"" dengan aplikasi perpesanan lainnya",Teknologi
"Diduga menyebabkan kanker, Pfizer tarik obat darah tinggi dari peredaran",Kesehatan
Intel mengumumkan Arc A-series dari grafis diskrit untuk laptop,Teknologi
"Bruce Willis Berhenti Acting karena Afasia, Apa itu?",Kesehatan
Alasan jangan skip sahur menurut ahli,Kesehatan
12 April 2022 Peraturan Euro 4 mobil Diesel diberlakukan,Teknologi
Gubernur Bank Sentral Sri Lanka mengundurkan diri,Finansial
"Belum selesai, muncul lagi COVID Xe",Kesehatan
Top up dompet digital kena PPN 11 persen,Finansial
"Hidup tanpa rasa sakit, berkat atau kutuk?",Kesehatan
Google dan iFixit meluncurkan Program Perbaikan Mandiri untuk perangkat Pixel,Teknologi
Rusia berpotensi gagal bayar utang obligasi,Finansial
Hari Perdana GOTO di Bursa,Finansial
Mengenal pendarahan otak yang dialami Ade Armando,Kesehatan
Inflasi Inggris sentuh level 7 persen pada Maret 2022,Finansial
CEO Nexo Memperkirakan Bitcoin dapat mencapai 100.000 Dollar AS!,Finansial
WHO: Vaksin HPV Bisa Cegah Kanker Serviks,Kesehatan
Waduh akan ada yang mengikuti jejak Rusia dan Sri Lanka gagal bayar utang,Finansial
Hati-hati Salmonella di telur!,Kesehatan
AS Melarang Tes Misil Anti-Satelit,Teknologi
Ekosistem Mobil Listrik Indonesia Diguyur Ratusan Triliun Rupiah,Finansial
Apple mencapai kesepakatan dengan BOE untuk layar iPhone 14,Teknologi
28 April 2022 CPO dan Minyak Goreng Resmi dilarang Ekspor,Finansial
Menuju Target Bebas Malaria 2030,Kesehatan
"PT Garuda Indonesia Tbk. Mendapatkan Penyertaan Modal Negara Senilai Rp7,5 triliun.",Finansial
"Elon Musk menggalang dana sebesar 46,5 Dolar AS untuk membeli penuh Twitter!",Finansial
"CPO Dilarang Ekspor, Harga TBS Sawit Terjun Sampai 50 persen",Finansial
Apple meningkatkan stok seri iPhone 13 Pro sehubungan dengan meningkatnya permintaan.,Teknologi
Galur hepatitis misterius memakan korban,Kesehatan
Tips-tips menghilangkan jerawat,Kesehatan
Work From Home Selamanya? Airbnb aja,Finansial
Tips meredakan kelelahan setelah lebaran,Kesehatan
"Harga emas berjangka Comex Juni turun 1,6%",Finansial
Futures Contract Indeks Dow Jones Menukik Tajam,Finansial
"Hati-hati dehidrasi, hati-hati overhidrasi",Kesehatan
"Mewabah di Indonesia, Kenali Penyakit Mulut dan Kuku",Kesehatan
"Pemerintah India Larang Ekspor Gandum, Harga Gandum Melemah 0,11%.",Finansial
Jerman Stop Impor Minyak Dari Rusia,Finansial
Aturan penggunaan masker dilonggarkan,Kesehatan
"Sedang Pergantian Musim, Waspadai Flu Singapura",Kesehatan
Donor darah untuk kebaikan diri sendiri,Kesehatan
"Investor Pasar Modal Naik 15,11 Persen",Finansial
Resmi! Presiden Komisaris OVO Mengundurkan Diri,Finansial
"Menular, beberapa cara terhindar dari cacar monyet",Kesehatan
Tedros terpilih kembali sebagai dirjen WHO 2022-2027,Kesehatan
BRImo Ada Fitur Konversi Valas Secara Real-Time!,Finansial
GOTO masih Rugi nih…,Finansial
"Vaping lebih aman dari rokok, betulkah?",Kesehatan
Apa yang terjadi ketika kita tenggelam?,Kesehatan
Tax Amnesty Jilid II Akan Segera Berakhir,Finansial
"Indeks Shanghai Naik 1,28 persen",Finansial
Mengenal bahaya kanker serviks yang diderita Lois Owien,Kesehatan
Waspadai kandungan BPA pada Galon Guna Ulang,Kesehatan
Justin Bieber terserang sindrom langka Ramsay Hunt,Kesehatan
IHSG Hari ini masih diperkirakan turun: “yang konflik siapa… yang susah siapa…”,Finansial
Google engineer says Lamda AI system may have its own feelings,Teknologi
"Thailand legalkan ganja, amankah?",Kesehatan
"Paul Fransiskus terkena Osteoarthritis, sebenarnya apa itu?",Kesehatan
"Bitcoin jatuh habis sepekan terakhir, kok bisa?",Finansial
"97,45% Kreditur Menyepakati Proposal Damai Garuda Indonesia",Finansial
"Waspada, cacar monyet mendekat ke Indonesia",Kesehatan
"Pabrik Baru Tesla Masih Boncos Jutaan Dolar, Salahnya Dimana?",Finansial
"Huawei meluncurkan Freebuds Pro 2 dengan Noise Cancelling, IP54, dan dual driver!",Teknologi
Instagram mulai mencoba metode verifikasi video untuk mengetahui usia penggunanya.,Teknologi
"Modal Asing Keluar Rp 8,35 Triliun Dari Pasar Keuangan",Finansial
"Tidak hanya mania dan depresi, ada juga episode ke-3 dalam gangguan bipolar",Kesehatan
"Jangan sembarangan, begini cara pertolongan pertama pasien epilepsi",Kesehatan
Mengenal sekumpulan gangguan kesehatan Tjahjo Kumolo,Kesehatan
Kementerian Pertanian terbobol?!,Teknologi
BFIN bagi-bagi dividen nih…,Finansial
"Waspada, hepatitis akut pada anak bisa menyebabkan otak keracunan amonia",Kesehatan
"Indeks Shanghai Naik 1,28 persen",Finansial
"Waspada Omicron BA.2.75, keturunan baru dari galur BA.2",Kesehatan
Perlukah suplemen protein untuk membentuk otot?,Kesehatan
"5G ditolak kembali! Warga Havant, Inggris menolak Pembuatan Tiang Telepon 5G",Teknologi
"Tingkat Pengangguran AS Stabil, Rupiah Menguat Rp14.979 per Dolar AS",Finansial
"Hati-hati Hijabers, ini yang harus dilakukan bila tersedak jarum pentul",Kesehatan
"Antibiotik tak berkutik, phage pun disuntik",Kesehatan
"Sempat gagal, peneliti AS sukses mencangkok jantung babi ke pasien mati otak",Kesehatan
Ponsel Cerdas yang “Segar” dari Nothing Phone 1,Teknologi
Jerry Ng menjadi pengendali BFIN,Finansial
Kasus Cacar Monyet Tembus Mencapai 11 Ribu Kasus di Seluruh Dunia,Kesehatan
Long COVID ternyata dialami 2/3 pasien di Indonesia,Kesehatan
Direktur Eksekutif UNICEF: Kesehatan anak berada dalam kode merah,Kesehatan
"Mengandung etilen oksida, es krim Haagen-Dazs ditarik dari peredaran",Kesehatan
Update PSE Kominfo: Google dan Youtube masih belum terdaftar,Teknologi
Citi Indonesia Luncurkan Program SSCF Tuk Bantu Klien Dan Mitra Di Indonesia,Finansial
Facebook Akan Rombak Tampilan Halaman Depan Mirip TikTok,Teknologi
Tak kunjung kurus? Operasi bariatrik (bukan) solusinya,Kesehatan
"Waspada, Kasus Cacar Monyet Meningkat di Negara Tetangga, Singapura.",Kesehatan
"Turun pesawat, Jokowi langsung diantar ‘mobil termahal China’",Teknologi
"Cacar monyet mewabah, kenali vaksin Imvanex",Kesehatan
Aturan Google memblokir aplikasi diabetes anak-anak,Teknologi
Waduh Wall Street Turun Nih,Finansial
"Hari ASI Sedunia, apa sih pentingnya ASI?",Kesehatan
Parasetamol bervirus Machupo? UGM: Hoax!,Kesehatan
"Semakin mewabah, kenali dua cara cek status cacar monyet!",Kesehatan
AS menggelontorkan dana 280 miliar dolar ke sektor teknologi untuk menyaingi China,Finansial
Sunscreen Banana Boat ditarik karena benzena. Ada apa dengan benzena?,Kesehatan
Pentingnya Digital Governance pada Industri Keuangan.,Finansial
"Kembali down akibat hacker, Pemasok IT untuk layanan darurat kesehatan Inggris, NHS mendapat serangan ransom.",Teknologi
Leak dari Menkes: Ini Daftar 4 Penyakit yang Bikin Bangkrut BPJS Kesehatan,Kesehatan
Eh kok bisa kecolong? Mengenal kleptomania,Kesehatan
Nasa Makin Serius! Roket utama untuk misi kembali ke bulan akan diujicoba pada akhir Agustus ini!,Teknologi
"Ada Masalah, Museum 11 September di New York Ditutup",Finansial
"Triple Whammy! Pria Italia Terkena Cacar Monyet, COVID-19, dan HIV bersamaan",Kesehatan
Zatko mengekspos lubang raksasa sekuriti Twitter,Teknologi
Diskon Tiket Pesawat Garuda Indonesia,Finansial
Wow! Kini QRIS buatan Indonesia Go Global,Finansial
Klarifikasi: 414 Kasus HIV Mahasiswa Bandung adalah Akumulasi Tiga Dekade,Kesehatan
"BAF raup pembiayaan Rp5,4 triliun per Juni 2022.",Finansial
"Hipertensi mengintai, begini 8 tips mencegahnya",Kesehatan
Pemerintah Resmi Naikan Tarif Ojek Online per 10 September.,Finansial
"Demi zero-Covid, pemerintah China mengunci penduduk Chengdu saat gempa",Kesehatan
Yahh.. Penjualan apartment tidak sesuai ekspetasi,Finansial
"Hidrogen: Dulu membuat Zeppelin terbakar, sekarang disedot emak-emak",Kesehatan
"Warga Karawang Keracunan Gas Klorin, Sekarang Sudah Bisa Pulang",Kesehatan
"Jadi rekor sampai membuat situs Flightradar24 ‘crash’, hampir 5 Juta orang ‘mengikuti’ penerbangan terakhir Ratu Elizabeth II.",Teknologi
"Jari Raja Charles Bengkak, Ini Penyebabnya",Kesehatan
"Minum Parasetamol, Demam Hilang, Nyawa pun Melayang",Kesehatan
Peringatan pesan penipuan warga Inggris raya atas ‘subsidi tagihan energi’,Teknologi
Baru terlihat sedikit ternyata jamurnya membukit,Kesehatan
"2023, minuman manis dicukai?",Finansial
Cahaya di Ujung Terowongan untuk Pandemi Covid-19 Indonesia,Kesehatan
Korea Utara menembakkan misil melintasi Jepang dalam Eskalasi,Teknologi
Penerbangan Perdana Maskapai LCC TransNusa,Finansial
Ilmuwan Inggris temukan golongan darah baru,Kesehatan
"(Advetorial) Kalau orang gak bisa relate sama bertapa sirkelmu menjaga kesehatan mentalmu, ahlipun juga begitu…",Kesehatan
Penyakit Ginjal Misterius Menyerang Lebih Dari 100 Anak,Kesehatan
"No Bra Day, Kenali Manfaat Tanpa Bra Bagi Kesehatan",Kesehatan
"Tak Ada Angin. Tak Ada Hujan, Jadilah IndoVac",Kesehatan
"Steven Indra Wibowo Meninggal Diduga Serangan Jantung, Kenali Gejalanya!",Kesehatan
Kinerja Garuda membaik setelah lolos PKPU,Finansial
"Buntut Kontaminasi Etilen Glikol dan Dietilen Glikol, BPOM Melarang Penjualan Obat Sirup",Kesehatan
"Hati-hati, virus Omicron XBB sudah masuk Indonesia",Kesehatan
"Situs Resmi LIB di Deface, Akankah Membawa Perubahan Positif?",Teknologi
"Sudah Dinyatakan Aman oleh BPOM, Sudah Aman Dikonsumsi?",Kesehatan
"Dampak Resesi Kian Nyata, Jangan Panik! Ini Cara Amankan Finansial",Finansial
"Covid-19 Kembali Naik, China Terapkan Strategi Nol Covid dengan Pembatasan Sosial",Kesehatan
Ancaman PHK Massal Terjadi di Sektor Industri,Finansial
Tanda-tanda Pelonggaran Zero-Covid Policy China Mulai Terlihat,Kesehatan
"NASA Luncurkan Roket ke Bulan, Misi Artemis 1 Dimulai",Teknologi
Piala Dunia 2022 di Qatar Telah Resmi dimulai,Olahraga
"Satu Miliar Orang Beresiko Kehilangan Pendengaran, Apakah Kamu Salah Satunya?",Kesehatan
"ShellBank, Aplikasi Pemutus Perdagangan Penyu Ilegal",Teknologi
"Memandang ke 2023 “Terlalu Optimis”, Diperkirakan Terjadi Penyesuaian Suku Bunga Fed dan Pembukaan Kembali Ekonomi Cina.",Finansial
RUU Kesehatan Menuai Perdebatan Antara Organisasi Profesi dan Kementerian Kesehatan,Kesehatan
Saham RI Memiliki Kemajuan Pesat Hingga Jadi Tertinggi Ke-3 Di Dunia,Finansial
Racun Sadis Mengakibatkan Sekeluarga Di Magelang Tewas Dengan Keadaan Lambung Terbakar,Kesehatan
Jokowi Prediksikan 60% Mobil Listrik di Pasar Global Akan Bergantung Pada Baterai RI,Finansial
"Terjadi Wabah Flu Burung, Peru Umumkan Darurat Kesehatan",Kesehatan
"AS Ijinkan Rebyota, Pengobatan Pertama Menggunakan Mikrobiota Tinja",Kesehatan
"Lord Rangga Tutup Usia Diduga Kelelahan Jadi Pemicu, Ini yang Harus Diwaspadai!",Kesehatan
"Tercemar EG-DG Melebihi Batas Aman, BPOM Mencabut Izin Edar 32 Obat dari PT REMS",Kesehatan
"Sembilan Anak di UK Meninggal Akibat Infeksi Strep A, Orang Tua Diminta Waspada",Kesehatan
Satelit ICON Nasa Hilang Kontak Sejak Akhir November Lalu,Teknologi
"Harga iPhone 15 Ultra Diprediksi Lebih Mahal Dari 14 Pro Max, Akankah Jadi HP Termahal?",Teknologi
Xiaomi Membuktikan Bahwa Pasta Gigi Memperparah Retak pada Layar,Teknologi
Tokopedia Naikkan Biaya Layanan dan Biaya Bebas Ongkir Mulai 2 Januari 2023,Finansial
"Bos Kripto FTX, Sam Bankman-Fried Ditangkap Kepolisian Bahama Karena Kasus Penipuan",Finansial
Apple akan memperbolehkan penginstalan dari Luar Appstore pada update mendatang,Teknologi
Samsung Mobile Akan Membentuk Tim Perancang Chipset untuk Menyaingi Samsung Exynos,Teknologi
Cara-cara Saintifik Mengungkap Pemilik Jari di Dalam Sayur Lodeh,Teknologi
Preview Final Piala Dunia 2022: Siapa Raih Bintang Ketiga?,Olahraga
Teaser Terbaru Vivo Tunjukkan Tanggal Rilis Resmi X90 Series di Pasar Global,Teknologi
Rumor PHK Xiaomi Bikin Panik Ribuan Pegawainya di Tiongkok,Teknologi
Bingung Sama Tulisan Dokter? Google Solusinya!,Teknologi
"Tak Peduli Crypto Winter, Kazakhstan Masih Mencari Peluang Dalam Mata Uang Crypto",Finansial
iPhone SE Generasi 4 Dikabarkan akan Ditunda Hingga 2024,Teknologi
"Tak Perlu Cemas Lagi, Ini Daftar Obat Sirup Yang Aman",Kesehatan
Mediatek Sekali Lagi Rajai Pasar Chipset yang Kompetitif,Teknologi
Redmi K60 Pro Dikonfirmasi akan Membawa Chipset Terkuat Qualcomm!,Teknologi
"Twitter Menghapus Fitur Suicide Prevention, Gara-gara Elon Musk(?)",Teknologi
"Suti Karno Amputasi Kaki Karena Diabetes, Kenali Gejalanya",Kesehatan
Sebuah iPhone 12 Pro Utuh Setelah Jatuh dari Lantai 26!,Teknologi
Smartphone dengan Kecepatan Charging Terkencang di Dunia akan Rilis Pada 5 Januari Tahun Depan,Teknologi
"Ponsel Keluaran Lama Tahun Depan Tidak Bisa Lagi WhatsApp-an, Simak Daftarnya!",Teknologi
Kasus Kematian Pertama Akibat Amoeba Pemakan Otak Terjadi di Korsel,Kesehatan
Apple Harus Merilis Setidaknya 5 Model Berbeda untuk iPhone di Masa Mendatang,Teknologi
Kasus Kematian Akibat Covid-19 di China Capai 9 Ribu Per Hari,Kesehatan
Ronaldo Resmi Gabung Klub Al-Nassr,Olahraga
Tahun 2022 Berakhir dengan Risiko Munculnya Varian Baru Virus Corona Menurut Pakar Kesehatan ,Kesehatan
"Sempat Dialami Indra Bekti, Bagaimana Bisa Hilang Ingatan?",Kesehatan
"96,5% Sampel Air Pembuangan di Bandara Malaysia Mengandung Omicron",Kesehatan
iPhone 15 Series akan Menjadi Smartphone dengan Daya Tahan Baterai Terbaik,Teknologi
"Selain Cip, Semua Pelat Nomor Kendaraan Bakal Dipasang QR Code",Teknologi
Apple Diduga Akan Rilis AirPods Lite Saingi TWS Murah,Teknologi
"Bersaing dengan Google, Microsoft Akan Integrasikan Bing dengan ChatGPT",Teknologi
"PHK 18.000 Karyawan, Amazon Ternyata Punya Robot Pekerja",Teknologi
"Mahasiswi Yogyakarta Ditemukan Tewas di Kamar Kos, Diduga Alami Asam Lambung",Kesehatan
"Realme Konfirmasi Smartphone Pertama dengan Teknologi Fast Charging 240W, Diprediksi akan Rilis di Indonesia",Teknologi
Catat! iPhone Seri Ini Dikabarkan Tidak Akan DIteruskan Apple,Teknologi
"SS-1, Satelit Nano Pertama Buatan Indonesia Meluncur ke Orbit",Teknologi
"Bercermin dari Kasus Indra Bekti, Ini Tips Mencegah Gagal Klaim Asuransi ",Kesehatan
Poco X5 Pro akan dirilis awal di India Akhir Bulan Ini!,Teknologi
"Kalah dari Vietnam, Langkah Indonesia Terhenti di Piala AFF 2022",Olahraga
KPUN Minta Perlindungan Jokowi dari Tsunami Ayam Broiler,Kesehatan
iPhone 15 Pro yang Akan Datang Akan Bawa 6 Fitur Terbaru Ini!,Teknologi
Sony Rilis Project Leonardo Stik PS5 yang Ramah Difabel,Teknologi
Apple Watch Mungkin Saja Akan Di-Banned di Amerika Serikat Karena Ini,Teknologi
"Ciki Ngebul Terus Menelan Korban, Kemenkes Keluarkan Surat Edaran",Kesehatan
"Covid Terkendali, Kemenkes Kembali Berfokus pada Imunisasi Rutin",Kesehatan
La Nyalla Kembali Calonkan Diri Menjadi Ketua PSSI,Olahraga
Kominfo Blokir 7 Situs Jual Beli Organ Tubuh Manusia,Teknologi
R’Bonney Gabriel Dinobatkan Menjadi Miss Universe 2022,Hiburan
Is It The Downfall of Liverpool?,Olahraga
Inilah Standar Baru Tarif Jaminan Kesehatan Nasional ,Kesehatan
Xiaomi dan Poco Mengadakan Gathering Akbar Bertajuk Xiaomi-Poco Community 2023 ,Teknologi
Apple Akhirnya Mulai Mampu Memenuhi iPhone 14 Pro Series yang Membludak dari Akhir Tahun Lalu,Teknologi
"Tak Hanya Gambar, AI Kini Ikut Terjun dalam Bidang Kesehatan",Teknologi
"Launching Poco F5 Sudah Dekat, Produksi Massal Sudah Dimulai di Eropa dan Asia",Teknologi
"PSSI Rilis Bakal Calon Ketua, Wakil, dan EXCO, Banyak Nama Tenar ",Olahraga
"Intinya… Xiaomi dan Poco mengundang penggemar terpilih di acara Xiaomi-Poco Community Gathering 2023 yang berlangsung di dua kota, yakni Jakarta dan Bandung pada 13-14 Januari 2023. ",Teknologi
Samsung Akhirnya akan Mengurangi Lipatan Layar di Galaxy Fold Selanjutnya,Teknologi
"Viral Live TikTok Mandi Lumpur, Polisi Turun Tangan",Teknologi
"Kemasan Penjualan X90 Telah Bocor, Segera Rilis Resmi di Indonesia?",Teknologi
"Terjerat Kasus Pemalsuan Dokumen, Juventus Terima Sanksi dari FIGC",Olahraga
Siri Ternyata Bisa Dibuat Lebih Pintar Dengan ChatGPT,Teknologi
Indonesiabaik,Kesehatan
"Mandi Lumpur Demi Uang, Simak Bahayanya!",Kesehatan
"Vivo X90 Series Segera Meluncur Awal Bulan Depan, Bocoran Antutu, Harga, Pilihan Warna, dan Spesifikasi Telah Muncul",Teknologi
"Dana Nasabah BCA Dicuri Tukang Becak hingga Rp320 Juta, OJK Imbau Nasabah Waspada",Finansial
"Spesifikasi Poco X5 dan X5 Pro Bocor, akan Rilis Secepatnya Awal Tahun Ini",Teknologi
"Sekarang, ATM Mandiri Bisa Setor Tarik Tunai Rp10.000",Teknologi
"NBA Umumkan Starter Pool untuk NBA All-Star 2023, LeBron dan Giannis Kembali Menjadi Kapten",Olahraga
Tab Incognito di Chrome Kini Bisa Dikunci Menggunakan Fingerprint Unlock,Teknologi
Wednesday: Menjelajah Nevermore dan Misteri di Dalamnya,Hiburan
Fitur Apple Terbaru Ini Selamatkan 2 Nyawa di Kanada!,Teknologi
"Kabar Baik! Angka Stunting Indonesia Turun 2,8 Persen ke 21,6 Persen",Kesehatan
WhatsApp Siapkan Fitur Baru Pesan Suara di WA Status dan Edit Foto Mirip Instagram Story,Teknologi
Samsung S23 Varian 128GB Dibuat Lebih Lambat dari yang Lain,Teknologi
Kominfo Gelar Pelatihan Terhadap Serangan Siber,Teknologi
"Bursa Transfer Resmi Ditutup, Klub EPL Menjadi yang Teraktif",Olahraga
"Berantas Calo, Bikin SIM Wajib Scan Wajah",Teknologi
Apple Capai 2 Miliar Perangkat Aktif di Seluruh Dunia,Teknologi
Film Enola Holmes 2: Pecahkan Kasus Bersama Detektif Sherlock dan Enola!,Hiburan
OpenAI Luncurkan ChatGPT Versi Berbayar dengan Fitur Prioritas,Teknologi
"iPhone Generasi Pertama Dilelang, Harganya Ditaksir Senilai Rp754 Jutaan",Teknologi
"Anak Terancam Gagal Ginjal Karena Sirup Lagi, Bagaimana Langkah Pemerintah?",Kesehatan
"Uji Coba Bayar Tol Tanpa Setop Mulai Sebelum Juni 2023 di Bali, Gerbang Tol Bakal Hilang, Nih!",Teknologi
"Apple Akan Rilis iPhone Ultra pada 2024, Ungguli iPhone Pro Max",Teknologi
Apple Berhasil Mematenkan Under-Display FaceID,Teknologi
"Google Perkenalkan Bard, Chatbot Berbasis AI yang Akan Jadi Pesaing ChatGPT",Teknologi
Android 14 Mampu Menghapus Aplikasi Bawaan yang Tidak Kamu Pakai!,Teknologi
"Game Hogwarts Legacy Rilis di Indonesia, Ayo Jelajahi Dunia Sihir Seperti Harry Potter!",Hiburan
"Walau iPhone 15 Bisa Pakai USB-C, Ternyata Kamu Tidak Bisa Pakai Sembarang Kabel!",Teknologi
Indonesia Kirim Bantuan Kemanusiaan untuk Korban Gempa Turki-Suriah,Kesehatan
"Suga BTS Konser Agust D Tour di Indonesia selama Tiga Hari, Catat Jadwalnya!",Hiburan
Hasil Pemilihan Pengurus PSSI: Wajah Baru Mendominasi,Olahraga
Indonesia International Motor Show Digelar di Kemayoran hingga 26 Februari Mendatang!,Teknologi
Samsung Galaxy S23 Ultra Mengalami Bug Aneh di Bagian Kamera Stabilization,Teknologi
"Jawaban Bing Search Error, Microsoft Batasi Chat hanya 5 Pertanyaan",Teknologi
Indonesia Membuka Peluang Kerjasama dengan Takeda Science Foundation ,Kesehatan
Game Angry Birds Original akan Dihapus dari Play Store Hari Ini!,Teknologi
"Netflix di Indonesia Turunkan Harga Langganan, Paket Basic Mulai Rp65 Ribu!",Teknologi
"Mantan Bos FTX, Sam Bankman-Fried Kembali Dituntut Empat Dakwaan Baru",Finansial
"Kasus Suspek Pertama Ditemukan di Spanyol, ini Bahaya Virus Marburg!",Kesehatan
"Dengan SATUSEHAT, 400 Aplikasi Bisa Diintegrasikan",Teknologi
"Xiaomi, Oppo, dan Perusahaan Lainnya Sedang Mengerjakan Proyek Komunikasi Satelit Bersama Qualcomm",Teknologi
BMKG Uji Coba Alat China yang Bisa Berikan Peringatan Sebelum Terjadi Gempa,Teknologi
Satu Dari Setiap Dua Orang Diprediksi Obesitas pada 2035,Kesehatan
Samsung Berhasil Menjual Smartphone Foldable Lebih dari Total Keseluruhan Brand Lain,Teknologi
Chipset Terbaru Qualcomm Dikabarkan akan Melewati Performa dari chip Apple 17 Bionic,Teknologi
Ratusan Ribu Mobil Listrik Xiaomi Ditargetkan Mulai Diproduksi Tahun 2024,Teknologi
"Samsung Galaxy A34 dan A54 akan Dijual Lebih Murah di Beberapa Negara, Salah Satunya di Indonesia",Teknologi
Serba-serbi Konser BLACKPINK WORLD TOUR [BORN PINK] JAKARTA,Hiburan
"Akibat Kondisi Kevin Tak Fit, The Minions Mundur dari All England 2023",Olahraga
Hati-hati Link Palsu SATUSEHAT Melalui Whatsapp,Teknologi
Kenali Efek Buruk Sering Gonta-Ganti Jenis BBM pada Motor,Teknologi
"Enam Venue Piala Dunia U-20, Yakin Lolos Inspeksi FIFA?",Olahraga
Tanzania Memulai Penyelidikan Penyakit Misterius setelah Lima Orang Meninggal,Kesehatan
"Alat Kesehatan Bergantung Impor, RUU Kesehatan Mungkin Solusinya",Kesehatan
Minum Oralit Saat Puasa Beresiko Merusak Ginjal,Kesehatan
Obat Obesitas Dipertimbangkan Masuk ke Daftar Obat Esensial,Kesehatan
Pemerintah Merespon Pengobatan Ajaib Ida Dayak,Kesehatan
Implementasi Transformasi Kesehatan Melesat Melalui Kerja Sama Indonesia-RRT,Kesehatan
China Melaporkan Kematian Pertama Oleh Flu Burung H3N8,Kesehatan
Kemenkes Menyediakan Skrining 14 Penyakit Gratis,Kesehatan
TV Neo QLED Samsung Menerima Sertifikasi Jejak Karbon,Teknologi
"Menjelang Mudik Lebaran 2023, Kemenkes Siapkan Ribuan Posko Kesehatan",Kesehatan
Samsung Melaporkan Pendapatan Kuartalan Terburuk dalam 14 Tahun,Teknologi
"Hampir Dimakan Jokowi, Apa Bahaya Formalin Bagi Manusia?",Kesehatan
"Atlet Para Tenis David Jacobs Meninggal Dunia, Mungkin Ini Penyebabnya!",Kesehatan
Uji Coba Eli Lilly Menemukan Obat Alzheimer Dapat Memperlambat Perkembangan Penyakit,Kesehatan
"Darurat Kesehatan Global Covid-19 Dinyatakan Selesai, Kemenkes: Bukan Berarti Pandemi COVID-19 Berakhir",Kesehatan
NFT petenis nyentrik sudah mulai dijual,Finansial
Risiko di Balik Manfaat Diet Keto,Kesehatan
NASA berencana untuk memensiunkan International Space Station pada 2031,Teknologi
2 Maskapai Penerbangan Raksasa Indonesia Kolaps dan Lakukan PHK Massal,Finansial
Mandalika Siap Digilas Roda,Olahraga
Boom… US$ 90/Barel Minyak AS Pecah Rekor,Finansial
Microsoft mulai uji coba fitur baru eksperimental Windows 11,Teknologi
Mark Zuckerberg Masih Jadi Orang Terkaya?,Finansial
Twitter punya fitur downvote?,Teknologi
Game Berkualitas Ini Hanya Dibuat Oleh Satu Orang,Gaming
Sertifikat Vaksin COVID-19 Internasional dari Indonesia Sudah Terbit!,Kesehatan
Yuk simak fitur-fitur rahasia dari whatsapp,Teknologi
TikTok Uji Kembali Batasan Konten yang Beredar,Teknologi
Siasat Pemulihan Ekonomi Daerah,Finansial
Omicron Sudah Mulai Berdampak Pada Bisnis Perhotelan,Finansial
Mencegah Gejala Berat dan Kematian Akibat Covid-19 dengan Vitamin D,Kesehatan
"Ikut Tren NFT, Anang Hermansyah Kena Masalah dengan Kementerian Perdagangan?",Finansial
